{
  "schema": "mva.track1-evidence-ledger/v1",
  "ledger_id": "synthetic-qualitative-example",
  "purpose": "Demonstrate normalized positive, negative, and not-assessable audit rows using synthetic placeholders only.",
  "entries": [
    {
      "evidence_id": "synthetic-positive-001",
      "model_slot": 1,
      "claim": "The synthetic allele pair satisfies the predeclared inheritance rule.",
      "allele_or_pair_id": "synthetic-pair-a",
      "evidence_type": "inheritance-consistency",
      "privacy_class": "synthetic",
      "phase": "phenotype_blind_discovery",
      "phase_state": "trans_confirmed",
      "direction": "supports",
      "assessment_status": "positive",
      "method_id": "full-public-auto",
      "source_class": "synthetic_fixture",
      "source_identifier": "synthetic-fixture-a",
      "source_version": "synthetic-v1",
      "source_url": null,
      "tool_name": "synthetic-inheritance-tool",
      "tool_version": "0.0.synthetic",
      "tool_digest": "sha256:1111111111111111111111111111111111111111111111111111111111111111",
      "run_digest": "sha256:2222222222222222222222222222222222222222222222222222222222222222",
      "config_digest": "sha256:3333333333333333333333333333333333333333333333333333333333333333",
      "result": "rule_satisfied",
      "unit": "categorical",
      "independent_replication": "replicated",
      "uncertainty": "The result establishes validator behavior only, not case validity.",
      "counterevidence": [],
      "decision_effect": "promote",
      "artifact_path": "templates/synthetic_evidence_artifact.txt",
      "artifact_sha256": "sha256:29c23d47065653952ab90158848b88724308e7f823c36c1b89a6baf1c1dc0d18",
      "manual_action": null,
      "reviewer": "synthetic-reviewer",
      "reviewed_at": "2026-08-26T00:00:00Z",
      "not_assessable_reason": null,
      "limitations": ["Synthetic fixtures demonstrate software behavior only."]
    },
    {
      "evidence_id": "synthetic-negative-001",
      "model_slot": 5,
      "claim": "The synthetic discordance check has no signal above its declared threshold.",
      "allele_or_pair_id": "synthetic-pair-a",
      "evidence_type": "discordance-check",
      "privacy_class": "synthetic",
      "phase": "orthogonal_validation",
      "phase_state": "not_applicable",
      "direction": "supports",
      "assessment_status": "negative",
      "method_id": "vcf-only",
      "source_class": "synthetic_fixture",
      "source_identifier": "synthetic-fixture-a",
      "source_version": "synthetic-v1",
      "source_url": null,
      "tool_name": "synthetic-discordance-tool",
      "tool_version": "0.0.synthetic",
      "tool_digest": "sha256:4444444444444444444444444444444444444444444444444444444444444444",
      "run_digest": "sha256:5555555555555555555555555555555555555555555555555555555555555555",
      "config_digest": "sha256:6666666666666666666666666666666666666666666666666666666666666666",
      "result": "no_discordance_detected",
      "unit": "categorical",
      "independent_replication": "not_attempted",
      "uncertainty": "A completed negative synthetic check does not establish a real-case finding.",
      "counterevidence": [],
      "decision_effect": "retain",
      "artifact_path": null,
      "artifact_sha256": null,
      "manual_action": null,
      "reviewer": "synthetic-reviewer",
      "reviewed_at": "2026-08-26T00:00:00Z",
      "not_assessable_reason": null,
      "limitations": ["A negative synthetic check is not evidence about a real case."]
    },
    {
      "evidence_id": "synthetic-not-assessable-001",
      "model_slot": 1,
      "claim": "Long-range phase cannot be determined in this synthetic exercise.",
      "allele_or_pair_id": "synthetic-pair-a",
      "evidence_type": "long-read-phase",
      "privacy_class": "synthetic",
      "phase": "completeness_audit",
      "phase_state": "not_assessable",
      "direction": "neutral",
      "assessment_status": "not_assessable",
      "method_id": "full-public-auto",
      "source_class": "synthetic_fixture",
      "source_identifier": "synthetic-fixture-a",
      "source_version": "synthetic-v1",
      "source_url": null,
      "tool_name": null,
      "tool_version": null,
      "tool_digest": null,
      "run_digest": null,
      "config_digest": null,
      "result": null,
      "unit": null,
      "independent_replication": "not_assessable",
      "uncertainty": "The missing modality prevents any positive or negative phase conclusion.",
      "counterevidence": [],
      "decision_effect": "defer",
      "artifact_path": null,
      "artifact_sha256": null,
      "manual_action": "Record the missing modality and do not infer a negative result.",
      "reviewer": "synthetic-reviewer",
      "reviewed_at": "2026-08-26T00:00:00Z",
      "not_assessable_reason": "The synthetic exercise intentionally supplies no long-read modality.",
      "limitations": ["No conclusion may be inferred from a not-assessable state."]
    }
  ]
}
